Sr.No,Name,Price,URL
1,"WALKENT Premium, Stylish & Semi-Hard Shell 15.6"" Laptop Bag | Anti-Theft Pocket | Waterproof Fabric & Zipper | Side Bottle Pocket | Office & College | For Men & Women ","2,009.",https://www.amazon.in/sspa/click?ie=UTF8&spc=MTo4NzQ4MDIzNTI4NDIzNTk4OjE2OTI3MTA4ODQ6c3BfYXRmX25leHQ6MzAwMDM1NzA1NDQzODMyOjowOjo&url=%2FWALKENT-Premium-Semi-Hard-Anti-Theft-Waterproof%2Fdp%2FB0CFJT6P1R%2Fref%3Dsr_1_81_sspa%3Fkeywords%3Dbags%26qid%3D1692710884%26sr%3D8-81-spons%26sp_csd%3Dd2lkZ2V0TmFtZT1zcF9hdGZfbmV4dA%26psc%3D1
2,"HOEXL 42L Expandable Laptop Backpack - Premium Laptop Backpacks for Men, Women for Travel, School, College - Tech Bag with USB - Bagpacker Bag for Men, 17 inch Laptop Bags for Multipurpose with Water-resistant, Smart Bag with Multiple Compartments ","3,219.",https://www.amazon.in/sspa/click?ie=UTF8&spc=MTo4NzQ4MDIzNTI4NDIzNTk4OjE2OTI3MTA4ODQ6c3BfYXRmX25leHQ6MzAwMDEyMzM5NDMyODMyOjowOjo&url=%2FHOEXL-Expandable-Laptop-Backpack-Water-resistant%2Fdp%2FB0C3J2RLHP%2Fref%3Dsr_1_82_sspa%3Fkeywords%3Dbags%26qid%3D1692710884%26sr%3D8-82-spons%26sp_csd%3Dd2lkZ2V0TmFtZT1zcF9hdGZfbmV4dA%26psc%3D1
3,"Genie Iridescence School Bag for Girls, 17 inch Backpack for Women, 3 Zips Water Resistant Stylish and Trendy College Backpacks for Girls. 27 litres ","3,290",https://www.amazon.in/Genie-Iridescence-Multicolor-Backpack-Resistant/dp/B084VQLJL8/ref=sr_1_83?keywords=bags&qid=1692710884&sr=8-83
4,NORTH ZONE Casual Waterproof Laptop Backpack/Office Bag/School Bag/College Bag/Business Bag/Travel Backpack (Dimensions:13x18 inches) (Compatible with 39.62cm(15.6inch laptop) 30 L ,"2,699",https://www.amazon.in/NORTH-ZONE-Waterproof-Backpack-Dimensions/dp/B0BS6QM2GD/ref=sr_1_84?keywords=bags&qid=1692710884&sr=8-84
5,Wildcraft 29.5 Ltrs Green Casual Backpack (11650-Green) ,753,https://www.amazon.in/Wildcraft-Green-Casual-Backpack-11650-Green/dp/B079DV66TY/ref=sr_1_85?keywords=bags&qid=1692710884&sr=8-85
6,"ROZEN 47 Ltrs, 46 cms School Bag Class 5-12 Large 5 partition Laptop Collage Office Travel Backpack Unisex ",630,https://www.amazon.in/ROZEN-School-partition-Collage-Backpack/dp/B0BRTDXVZC/ref=sr_1_86?keywords=bags&qid=1692710884&sr=8-86
7,ADISA Laptop Backpack 31 Ltrs ,990,https://www.amazon.in/ADISA-BP004-Weight-Casual-Backpack/dp/B07G3CG9FC/ref=sr_1_87?keywords=bags&qid=1692710884&sr=8-87
8,Genie Flamenco2 Casual Backpacks for Women ,697,https://www.amazon.in/Genie-Flamenco2-Backpack-Compatible-Resistant/dp/B08YF9VHTY/ref=sr_1_88?keywords=bags&qid=1692710884&sr=8-88
9,"ASUS TUF Gaming VP5700 46.14 cm Backpack (Black), with Water Repellent Fabric, Suitable for up to 43.18 cm Laptop ",399,https://www.amazon.in/ASUS-VP5700-Backpack-Repellent-Suitable/dp/B093HGZMHV/ref=sr_1_89?keywords=bags&qid=1692710884&sr=8-89
10,DEIN KLEIDER Men's Nylon Messenger Bag ,733,https://www.amazon.in/Kleider-Travel-Business-Messenger-Shoulder/dp/B084ZHP97M/ref=sr_1_90?keywords=bags&qid=1692710884&sr=8-90
11,"Arctic Hunter Hard-Top 15.6"" Laptop Bag 21L (Model Secure) Anti-Theft Built-in Combination Lock, Waterproof for Office, College, Men, Women ","1,289",https://www.amazon.in/sspa/click?ie=UTF8&spc=MTo4NzQ4MDIzNTI4NDIzNTk4OjE2OTI3MTA4ODQ6c3BfbXRmOjIwMTUzMDM4Nzg5MTk4OjowOjo&url=%2FSecure-Combination-Waterproof-College-Walkent%2Fdp%2FB09T71WXSF%2Fref%3Dsr_1_91_sspa%3Fkeywords%3Dbags%26qid%3D1692710884%26sr%3D8-91-spons%26sp_csd%3Dd2lkZ2V0TmFtZT1zcF9tdGY%26psc%3D1
12,"uppercase 26 Ltrs Ryder Professional Laptop Backpack (15.6 Inch) 3x more water resistant sustainable bags with rain proof zippers for Men, Women, Boys and Girls, 750 Days warranty ","2,998",https://www.amazon.in/sspa/click?ie=UTF8&spc=MTo4NzQ4MDIzNTI4NDIzNTk4OjE2OTI3MTA4ODQ6c3BfbXRmOjIwMTI3NjgzODcyMzk4OjowOjo&url=%2FUPPERCASE-Professional-Backpack-resistant-sustainable%2Fdp%2FB0BXFDK5J2%2Fref%3Dsr_1_92_sspa%3Fkeywords%3Dbags%26qid%3D1692710884%26sr%3D8-92-spons%26sp_csd%3Dd2lkZ2V0TmFtZT1zcF9tdGY%26psc%3D1
13,"Fur Jaden 15.6 Inch Laptop Backpack 25 LTR Bag for School, College and Office with USB Charging Port ",349,https://www.amazon.in/Fur-Jaden-Charging-Waterproof-BM36_BlueZip/dp/B07MXM5M99/ref=sr_1_93?keywords=bags&qid=1692710884&sr=8-93
14,Lunar's Comet 35L Water Resistant Travel Bagpack/College Backpack/School Bag/Office Bag/Business Backpack/Daypack for Men and Women with 1 Year Warranty ,"3,990",https://www.amazon.in/Lunars-Comet-Resistant-Casual-Backpack/dp/B07WN833M7/ref=sr_1_94?keywords=bags&qid=1692710884&sr=8-94
15,Police Large Size Walt Laptop Backpack Business Office College Travel Bags For Men Fits Upto 15 Inch Laptop Notebook - Black ,"2,400",https://www.amazon.in/POLICE-Stylish-Premium-Quality-Backpack/dp/B084Q4N84P/ref=sr_1_95?keywords=bags&qid=1692710884&sr=8-95
16,"Safari Crew Overnighter Backpack, 40 Ltr Water Resistant Travel Laptop Bag, Black Polyester Backpack for Men and Women, Spacious Shoulder Bag for Travelling and Camping ",479,https://www.amazon.in/Safari-Overnighter-Resistant-Polyester-Travelling/dp/B097JK3X9D/ref=sr_1_96?keywords=bags&qid=1692710884&sr=8-96
17,"Tabelito® NEO 3O L Water Resistant Laptop/College/Office/School/Travel/Business Bag, Unisex Backpack for Men Women Fits Up to 15.6 Inch Laptop Notebook. ",778,https://www.amazon.in/Tabelito-NEO-Backpack-Business-Compartment/dp/B0C2D2GPWJ/ref=sr_1_97?keywords=bags&qid=1692710884&sr=8-97
18,ADISA 32L large laptop backpack office bag college travel back pack with rain cover ,900,https://www.amazon.in/ADISA-Laptop-Backpack-Office-College/dp/B0BPVLXD53/ref=sr_1_98?keywords=bags&qid=1692710884&sr=8-98
19,DZert Clasy Laptop Bag College Bag for Boys Girls 21 L Blue White ,"1,689",https://www.amazon.in/DZert-School-Polyester-Backpack-White/dp/B07GXYHFCY/ref=sr_1_99?keywords=bags&qid=1692710884&sr=8-99
20,Half Moon 30L Water Resistant 15.6 inch Laptop Bag/Backpack for Men | School Bag for Boys Girls | Office Bag pack for Men/Office Back Packed for Women with Padded Laptop Compartment ,"1,709",https://www.amazon.in/Half-Moon-Laptop-Backpack-Polyester/dp/B09CMS3K2S/ref=sr_1_100?keywords=bags&qid=1692710884&sr=8-100
21,"uppercase Apex Professional Laptop Backpack (15.6 Inch) 3x more water resistant sustainable bags with rain proof zippers for Men, Women, Boys and Girls, 750 Days warranty ",399,https://www.amazon.in/sspa/click?ie=UTF8&spc=MTo4NzQ4MDIzNTI4NDIzNTk4OjE2OTI3MTA4ODQ6c3BfYnRmOjIwMTI1ODk5OTIwNjk4OjowOjo&url=%2FUppercase-Professional-Backpack-Resistant-Sustainable%2Fdp%2FB0BWNBQXDZ%2Fref%3Dsr_1_101_sspa%3Fkeywords%3Dbags%26qid%3D1692710884%26sr%3D8-101-spons%26sp_csd%3Dd2lkZ2V0TmFtZT1zcF9idGY%26psc%3D1
