Sr.No,Name,Price,URL
1,"WALKENT Premium, Stylish & Semi-Hard Shell 15.6"" Laptop Bag | Anti-Theft Pocket | Waterproof Fabric & Zipper | Side Bottle Pocket | Office & College | For Men & Women ","2,009.",https://www.amazon.in/sspa/click?ie=UTF8&spc=MToyMzkxMDMwODY3MTU2NTk4OjE2OTI3MTA5MTI6c3BfYXRmX25leHQ6MzAwMDM1NzA1NDQzODMyOjowOjo&url=%2FWALKENT-Premium-Semi-Hard-Anti-Theft-Waterproof%2Fdp%2FB0CFJT6P1R%2Fref%3Dsr_1_97_sspa%3Fkeywords%3Dbags%26qid%3D1692710912%26sr%3D8-97-spons%26sp_csd%3Dd2lkZ2V0TmFtZT1zcF9hdGZfbmV4dA%26psc%3D1
2,"HOEXL 42L Expandable Laptop Backpack - Premium Laptop Backpacks for Men, Women for Travel, School, College - Tech Bag with USB - Bagpacker Bag for Men, 17 inch Laptop Bags for Multipurpose with Water-resistant, Smart Bag with Multiple Compartments ","3,219.",https://www.amazon.in/sspa/click?ie=UTF8&spc=MToyMzkxMDMwODY3MTU2NTk4OjE2OTI3MTA5MTI6c3BfYXRmX25leHQ6MzAwMDEyMzM5NDMyODMyOjowOjo&url=%2FHOEXL-Expandable-Laptop-Backpack-Water-resistant%2Fdp%2FB0C3J2RLHP%2Fref%3Dsr_1_98_sspa%3Fkeywords%3Dbags%26qid%3D1692710912%26sr%3D8-98-spons%26sp_csd%3Dd2lkZ2V0TmFtZT1zcF9hdGZfbmV4dA%26psc%3D1
3,Half Moon 34 L Water Resistant 15.6 inch Laptop Bag/Backpack for Men Women Boys Girls/Office School College with Padded Laptop Compartment (Grey) ,"3,290",https://www.amazon.in/Half-Moon-Resistant-Backpack-Compartment/dp/B09GG53CSL/ref=sr_1_99?keywords=bags&qid=1692710912&sr=8-99
4,KILLER Louis 38L Large Laptop Backpack With 3 Compartments Polyester Trendy Waterproof Travel Backpack ,"2,699",https://www.amazon.in/Killer-Backpack-Compartments-Polyester-Waterproof/dp/B07CDD6YS2/ref=sr_1_100?keywords=bags&qid=1692710912&sr=8-100
5,"Amazon Basics Water Repellent and Wear Resistant Laptop Backpack - 24L, Blue ",698,https://www.amazon.in/Amazon-Basics-Laptop-Backpack-Repellent/dp/B09W43XLBY/ref=sr_1_101?keywords=bags&qid=1692710912&sr=8-101
6,Half Moon Strike 35L Unisex Spacious School/Laptop/College/Office Travel Backpack Bag for Men Women Boys & Girls with 15.6 inch Padded Laptop Compartment & Multiple Pockets ,"2,067",https://www.amazon.in/Half-Moon-Spacious-Backpack-Compartment/dp/B0C23BYDML/ref=sr_1_102?keywords=bags&qid=1692710912&sr=8-102
7,Gear Galaxy Universe 30 L Water Resistant School Bag/Kids Bag/Casual Backpack/Daypack/College Bag for Boys/Girls/Men/Women (Blue) ,649,https://www.amazon.in/Gear-Universe-Resistant-Backpack-Daypack/dp/B0BZWLBDV3/ref=sr_1_103?keywords=bags&qid=1692710912&sr=8-103
8,"Fur Jaden 15.6 Inch Laptop Backpack 25 LTR Bag for School, College and Office with USB Charging Port ",699,https://www.amazon.in/Fur-Jaden-Charging-Waterproof-BM36_BlueZip/dp/B07MXM5M99/ref=sr_1_104?keywords=bags&qid=1692710912&sr=8-104
9,"HARISSONS Bags Vervo 15.6-inch Laptop/Travel/Casual Backpack for Men and Women with Rain Cover (Black, 40 Ltrs) | Quick Access Zippered Pocket, Detailed Organizers & a Detachable Key Chain Holder ","1,095",https://www.amazon.in/HARISSONS-15-6-inch-Backpack-Organizers-Detachable/dp/B07M5P5LW3/ref=sr_1_105?keywords=bags&qid=1692710912&sr=8-105
10,F Gear Spartan 24 Ltrs Black Laptop Backpack (3179) ,479,https://www.amazon.in/F-Gear-Spartan-Black-Laptop-Backpack/dp/B07X82WYGL/ref=sr_1_106?keywords=bags&qid=1692710912&sr=8-106
11,"uppercase 26 Ltrs Ryder Professional Laptop Backpack (15.6 Inch) 3x more water resistant sustainable bags with rain proof zippers for Men, Women, Boys and Girls, 750 Days warranty ","2,960",https://www.amazon.in/sspa/click?ie=UTF8&spc=MToyMzkxMDMwODY3MTU2NTk4OjE2OTI3MTA5MTI6c3BfbXRmOjIwMTI3NjgzODcyMzk4OjowOjo&url=%2FUPPERCASE-Professional-Backpack-resistant-sustainable%2Fdp%2FB0BXFDK5J2%2Fref%3Dsr_1_107_sspa%3Fkeywords%3Dbags%26qid%3D1692710912%26sr%3D8-107-spons%26sp_csd%3Dd2lkZ2V0TmFtZT1zcF9tdGY%26psc%3D1
12,FUR JADEN Pro Series Smart Tech Anti-Theft Laptop Backpack With USB-A and USB-C Type Charging Port for Men & Women For Business Professionals & College Students ,623,https://www.amazon.in/sspa/click?ie=UTF8&spc=MToyMzkxMDMwODY3MTU2NTk4OjE2OTI3MTA5MTI6c3BfbXRmOjIwMTUzOTYyNDIxNDk4OjowOjo&url=%2FFUR-JADEN-Anti-Theft-Backpack-Professionals%2Fdp%2FB0C28QQMFJ%2Fref%3Dsr_1_108_sspa%3Fkeywords%3Dbags%26qid%3D1692710912%26sr%3D8-108-spons%26sp_csd%3Dd2lkZ2V0TmFtZT1zcF9tdGY%26psc%3D1
13,COSMUS Vogue Casual Laptop Backpack with USB Charger Port 46cm 26 Litre College Bag ,"2,400",https://www.amazon.in/Cosmus-Casual-Backpack-Charger-College/dp/B09HX54TGF/ref=sr_1_109?keywords=bags&qid=1692710912&sr=8-109
14,American Tourister Casual Backpack ,"3,499",https://www.amazon.in/American-Tourister-AMT-SCH-BAG02/dp/B07CGLDV2C/ref=sr_1_110?keywords=bags&qid=1692710912&sr=8-110
15,"Golden Wolf Laptop Bag Anti-theft Backpack with Lock College School Laptop Backpack with Rain Cover Water Resistant Business Backpack with USB Port for 15.6-inch Laptop Office Travel Bag for Men and Women Gifts, Dark Grey ","1,409",https://www.amazon.in/Hoteon-Backpack-Anti-Theft-Earphone-Resistant/dp/B08HM4TQZZ/ref=sr_1_111?keywords=bags&qid=1692710912&sr=8-111
16,"FATMUG Polyester Foldable Duffle Travel Bag Luggage For Travel, Packing And Storage - Men And Women - (60 L, Black) ","1,249",https://www.amazon.in/FATMUG-Foldable-Luggage-Packing-Storage/dp/B07YFNXC3H/ref=sr_1_112?keywords=bags&qid=1692710912&sr=8-112
17,Tabelito® Basic Laptop Bag Laptop Cover Laptop Bags Laptop Sleeve Office Bag Laptop Bag 15.6 inch(39.6cm) Laptop Apple/Lenovo/Asus/Hp/MacBook/Thinkpad/Ideapad (Grey) ,"1,999",https://www.amazon.in/Tabelito%C2%AE-Basic-Laptop-Sleeve-Surfacepro/dp/B09NDTW8SP/ref=sr_1_113?keywords=bags&qid=1692710912&sr=8-113
18,"MOKOBARA The Transit Backpack - 30L Premium Nylon 15.6"" Unisex Laptop Bag With Luggage Sleeve ","1,099",https://www.amazon.in/Mokobara-Transit-Backpack-Laptop-Sunray/dp/B09V7R98XC/ref=sr_1_114?keywords=bags&qid=1692710912&sr=8-114
19,Glowic Unisex's Backpack for Men Women Boys Girls/Office School College Teens & Students (WBAG-64) (Black) ,299,https://www.amazon.in/Glowic-Unisexs-Backpack-College-Students/dp/B0BGX9W69N/ref=sr_1_115?keywords=bags&qid=1692710912&sr=8-115
20,Skybags Unisex Grey Jacqard 34L Laptop Bags ,"4,999",https://www.amazon.in/Skybags-Unisex-Grey-Jacqard-Laptop/dp/B09ZV9SLBJ/ref=sr_1_116?keywords=bags&qid=1692710912&sr=8-116
21,"uppercase Apex Professional Laptop Backpack (15.6 Inch) 3x more water resistant sustainable bags with rain proof zippers for Men, Women, Boys and Girls, 750 Days warranty ",969,https://www.amazon.in/sspa/click?ie=UTF8&spc=MToyMzkxMDMwODY3MTU2NTk4OjE2OTI3MTA5MTI6c3BfYnRmOjIwMTI1ODk5OTIwNjk4OjowOjo&url=%2FUppercase-Professional-Backpack-Resistant-Sustainable%2Fdp%2FB0BWNBQXDZ%2Fref%3Dsr_1_117_sspa%3Fkeywords%3Dbags%26qid%3D1692710912%26sr%3D8-117-spons%26sp_csd%3Dd2lkZ2V0TmFtZT1zcF9idGY%26psc%3D1
